,address,birthdate,blood_group,company,job,mail,name,phone,residence,sex,ssn,username,website
262,"д. Сосьва (Хант.), ул. Степана Разина, д. 89, 778074",2005-04-23,AB-,РАО «Кузьмина-Костин»,Издатель,svjatopolknikonov@yahoo.com,Третьякова Елизавета Романовна,+7 798 903 53 90,"ст. Тотьма, ул. Воровского, д. 86, 829611",F,688514003593,vasili93,"['https://www.rao.com/', 'http://ao.edu/', 'http://www.ao.com/', 'https://ip.org/']"
263,"д. Новороссийка, ул. Специалистов, д. 70, 799023",2016-12-24,A+,РАО «Силин Овчинникова»,Почтальон,mamontovnarkis@mail.ru,Зуев Милен Елисеевич,+7 537 410 3187,"с. Плес, ул. Дачная, д. 06, 612700",M,370699497068,mihe60,"['https://makarov.ru/', 'https://ao.biz/']"
264,"п. Кижи, ул. Красногвардейская, д. 33, 710146",2001-10-03,AB+,ИП «Исаков»,Пчеловод,vteterin@yandex.ru,г-жа Баранова Прасковья Георгиевна,+7 (007) 684-0970,"к. Руза, ул. Зои Космодемьянской, д. 01, 346780",F,404596639828,tvorimir_62,"['https://ip.org/', 'https://ip.net/']"
265,"клх Кашхатау, ул. Володарского, д. 00, 536037",2016-02-18,AB-,АО «Романов»,Тележурналист,knjazevgorde@yandex.ru,Веселов Вячеслав Адамович,+7 484 523 55 85,"ст. Котельнич, ул. Разина, д. 77, 271490",M,946852092899,mihailburov,['https://www.ao.com/']
266,"г. Учалы, ул. Циолковского, д. 07, 823999",1999-12-03,AB-,Шестаков,Плотник,fedor1981apollinari_2010@gmail.com,Комиссарова Александра Кирилловна,+7 (233) 372-8957,"г. Гудермес, ул. Казанская, д. 71, 246267",F,423860004945,kazimir_61,"['http://www.ip.com/', 'https://rao.info/', 'https://npo.org/', 'http://ao.ru/']"
267,"к. Сургут (Хант.), ул. Магистральная, д. 67, 719734",1970-04-16,B-,АО «Блинова»,Лифтёр,harlampirozhkov@mail.ru,Кононова Ирина Андреевна,+7 864 945 11 20,"г. Новороссийск, ул. Гражданская, д. 69, 140661",F,999901763373,kulakovazinaida,"['https://npo.edu/', 'http://www.npo.org/', 'http://npo.ru/']"
268,"д. Юрьевец (Иван.), ул. Крупской, д. 18, 763953",2003-05-25,0-,Рябов,Выпускающий редактор,gabramov@yandex.ru,Носков Филипп Давидович,+7 164 822 2064,"д. Завьялиха, ул. Шолохова, д. 38, 110356",M,193965987331,strelkovaveronika,"['https://www.belova.ru/', 'https://www.npo.biz/']"
269,"с. Нальчик, ул. Никитина, д. 17, 290467",1974-02-20,A+,Стрелкова,Гранатомётчик,maksimovaanzhela@mail.ru,Гурьев Николай Федосеевич,+7 (656) 438-1550,"к. Оймякон, ул. Панфилова, д. 57, 240096",M,093862035303,qkalinin,"['https://rao.edu/', 'http://ao.edu/', 'https://ao.ru/', 'https://www.markov.edu/']"
270,"ст. Малгобек, ул. Лунная, д. 86, 866813",1977-11-04,A+,АО «Тихонов-Шашков»,Географ,nikonovmefodi@hotmail.com,Капустина Ольга Романовна,+7 002 325 51 08,"клх Мичуринск, ул. Короленко, д. 66, 423219",F,128074961947,galaktionermakov,"['http://rao.ru/', 'https://ip.net/', 'https://rao.org/']"
271,"ст. Норильск, ул. Толстого, д. 59, 009537",2015-10-14,A-,ИП «Воробьев Иванова»,Иммунолог,averki36@hotmail.com,Шашкова Евфросиния Оскаровна,+7 125 627 79 78,"д. Кедровый, ул. Тепличная, д. 54, 061481",F,676060696330,julija82,"['https://www.ip.biz/', 'http://www.npo.com/', 'https://www.ao.net/']"
272,"клх Калач, ул. Российская, д. 13, 667695",1999-01-05,AB+,"АО «Жданова, Емельянов и Харитонов»",Металлург,gorbachevvasili@gmail.com,Смирнов Елизар Глебович,+7 (656) 966-4805,"д. Костомукша, ул. Зои Космодемьянской, д. 52, 393872",M,805442837255,milovan_62,['http://www.rao.net/']
273,"п. Томари, ул. Бригадная, д. 06, 696912",1973-09-19,A-,НПО «Дорофеева-Беспалов»,Фотограф,tatjana_55@rambler.ru,Макарова Раиса Филипповна,+7 996 957 1707,"д. Кисловодск, ул. Революционная, д. 90, 391966",F,059586975161,muravevataisija,"['http://ip.edu/', 'https://www.rao.ru/', 'https://www.rao.org/', 'https://www.voronov.ru/']"
274,"клх Москва, ул. Киевская, д. 19, 214970",1997-10-19,0+,Блохина,Логик,spiridonlebedev@rambler.ru,Авдеева Екатерина Захаровна,+7 (311) 198-0543,"п. Кыштым, ул. Автомобилистов, д. 72, 528987",F,496521259596,kirill2013jakub_2004,"['http://ip.edu/', 'https://www.npo.biz/', 'https://www.ip.edu/']"
275,"г. Ербогачен, ул. Широкая, д. 71, 994776",2011-10-08,B-,НПО «Кошелева-Молчанова»,Наводчик орудия,averjan_97@hotmail.com,Ершов Казимир Ярославович,+7 420 583 7627,"ст. Нефтекамск, ул. Коммунаров, д. 05, 413537",M,012085780315,ilarion2005vera_1996,"['http://www.ao.edu/', 'http://ao.org/']"
276,"г. Моздок, ул. Проточная, д. 47, 121190",1999-04-14,B-,РАО «Колобов-Попов»,Токарь,nifontbobrov@yahoo.com,Кузьмина Мария Харитоновна,+7 749 699 9048,"г. Лесной (Сверд.), ул. Красногвардейская, д. 64, 708697",F,201717840186,stojan_33,"['http://www.ip.ru/', 'http://ip.ru/']"
277,"с. Киржач, ул. Тепличная, д. 73, 888075",1974-12-11,B-,"НПО «Суворов, Вишнякова и Зуева»",Копирайтер,lavrenti_60@mail.ru,Авдеева Вера Оскаровна,+7 (042) 462-1195,"к. Ставрополь, ул. Строительная, д. 54, 917325",F,864128242575,kasjan_65,"['http://www.ao.net/', 'http://www.ip.com/', 'https://www.rao.com/']"
278,"г. Курган, ул. Нахимова, д. 62, 934822",2017-12-30,AB-,НПО «Белозеров Мясников»,Музыкант,vladilenlapin@gmail.com,Сидорова Таисия Филипповна,+7 (661) 964-77-07,"клх Пушкинские Горы, ул. Крестьянская, д. 17, 276414",F,696477589403,androniksamsonov,['http://www.popova.org/']
279,"д. Буденновск, ул. Зеленая, д. 91, 336781",1983-10-16,AB-,РАО «Рыбакова»,Химик,kuzma1980julian_2002@hotmail.com,Фомичев Самсон Эдуардович,+7 (201) 838-9598,"ст. Биробиджан, ул. Морская, д. 59, 021572",M,551544195146,erasttitov,"['https://npo.net/', 'https://ip.net/', 'http://npo.com/', 'http://komissarova.biz/']"
280,"клх Хужир, ул. Учительская, д. 79, 279693",1982-01-16,AB-,ИП «Фомин»,Крупье,bobrovasinklitikija@yandex.ru,Михеев Марк Юлианович,+7 (848) 098-06-96,"к. Певек, ул. Республиканская, д. 31, 982325",M,978290137196,shchukinbojan,"['http://www.rao.ru/', 'https://www.npo.info/', 'https://zimin.com/', 'http://ip.biz/']"
281,"клх Бугульма, ул. Мусы Джалиля, д. 08, 555033",2001-05-16,0+,Яковлева,Офтальмолог,tsvetkovjakub@gmail.com,Куликова Мария Геннадьевна,+7 (516) 926-4829,"клх Джубга, ул. Космодемьянской, д. 77, 341967",F,113435733248,nshchukina,"['https://www.ip.info/', 'http://www.orehov.biz/', 'http://ao.ru/']"
282,"г. Сорочинск, ул. Северная, д. 35, 748538",1986-08-10,0-,НПО «Григорьева»,Иммунолог,ljubim_72@mail.ru,Молчанова Нинель Олеговна,+7 285 171 60 37,"ст. Белоярский, ул. Гастелло, д. 25, 312506",F,398026622357,cnikiforov,['https://www.ip.net/']
283,"с. Ржев, ул. Украинская, д. 52, 669329",2013-03-21,B-,ИП «Королев Борисова»,Наводчик орудия,vlasmjasnikov@yahoo.com,Копылова Лукия Егоровна,+7 390 631 01 39,"клх Беломорск, ул. Советская, д. 71, 499347",F,877177509830,pankrati1993nifont_1983,"['http://www.ip.info/', 'http://ip.org/', 'https://bespalov.com/']"
284,"г. Тутончаны, ул. Привольная, д. 81, 159766",2002-12-02,B+,НПО «Овчинникова-Лихачева»,Крановщик,kondrati_87@yandex.ru,Самсонова Майя Геннадиевна,+7 (658) 588-99-68,"клх Тюмень, ул. Ломоносова, д. 93, 666016",F,183986879536,kozlovatamara,"['http://ip.biz/', 'http://ip.com/', 'https://matveeva.org/', 'http://www.rao.com/']"
285,"п. Тула, ул. Станиславского, д. 00, 160674",2007-12-03,A+,НПО «Зимин-Фадеев»,Санитар,vladimirovljubomir@yandex.ru,Емельянова Агафья Наумовна,+7 (772) 506-4062,"ст. Люберцы, ул. Ангарская, д. 42, 077771",F,335698233515,ljudmila_63,['http://npo.biz/']
286,"г. Кондопога, ул. О.Кошевого, д. 84, 325876",1990-05-27,B+,"АО «Федосеев, Русаков и Титов»",Акушер,grigorevasofija@hotmail.com,Ершова Дарья Ивановна,+7 (918) 656-3434,"с. Печора, ул. Мусы Джалиля, д. 16, 861395",F,314011938777,sblinov,"['https://npo.ru/', 'http://www.npo.info/']"
287,"клх Чебаркуль, ул. М.Горького, д. 80, 327668",1980-03-14,B+,Новикова,Безработный,gedeonsuhanov@gmail.com,Полякова Лариса Леоновна,+7 (790) 443-75-15,"д. Сухиничи, ул. Песочная, д. 94, 015238",F,570161428589,isakovanaina,"['https://tihonov.org/', 'https://ao.com/']"
288,"ст. Архангельск, ул. Тенистая, д. 19, 486595",2002-02-14,AB+,ИП «Воробьев Воронова»,Скорняк,zinovevafevronija@yandex.ru,Назарова Александра Егоровна,+7 047 888 3759,"с. Красноярск, ул. Окружная, д. 89, 725464",F,016088878466,taras_86,"['http://npo.ru/', 'https://www.ip.edu/', 'http://rao.edu/', 'http://ip.biz/']"
289,"ст. Тотьма, ул. Партизанская, д. 23, 536370",2009-06-20,AB+,"РАО «Зиновьева, Кириллов и Воронов»",Ихтиолог,naum_77@mail.ru,тов. Котова Нонна Максимовна,+7 (318) 337-0861,"ст. Смирных, ул. Горького, д. 89, 401078",F,652898907317,efimovilarion,"['http://www.ip.ru/', 'http://www.ao.info/', 'https://www.rao.edu/']"
290,"с. Псков, ул. Володарского, д. 74, 574115",2005-05-01,B-,Савельев,Садовод,kuznetsoviosif@gmail.com,Мельников Ладимир Игоревич,+7 (805) 626-31-04,"п. Кинешма, ул. Тракторная, д. 24, 760660",M,437187661814,yantonova,"['https://ao.edu/', 'http://www.rao.org/', 'http://npo.info/']"
291,"клх Октябрьский (Башк.), ул. Волкова, д. 18, 397080",1986-03-31,B-,АО «Мухина-Карпова»,Религиовед,sharovkasjan@yandex.ru,Осипова Наталья Геннадиевна,+7 503 260 22 94,"с. Игнашино, ул. Седова, д. 63, 558090",F,889491137754,komarovnazar,['http://www.rao.biz/']
292,"к. Таганрог, ул. Красноярская, д. 38, 277771",1975-09-18,0+,"РАО «Баранова, Филатов и Кириллова»",Логопед,kim08@hotmail.com,Субботина Евпраксия Николаевна,+7 320 442 63 38,"ст. Калининград, ул. Республиканская, д. 59, 889493",F,677741110306,fokinprokl,['https://rao.org/']
293,"п. Усть-Камчатск, ул. Крылова, д. 64, 378880",1974-10-24,AB+,НПО «Костина Муравьева»,Маркшейдер,dnazarova@gmail.com,Дмитриева Вероника Максимовна,+7 (622) 754-7223,"с. Бугуруслан, ул. Свободы, д. 66, 579032",F,725435949590,fkulagin,"['https://www.ip.net/', 'https://www.ip.info/']"
294,"клх Истра, ул. Депутатская, д. 20, 128412",2000-01-04,B+,"НПО «Козлов, Русаков и Голубева»",Пулемётчик,kulaginkir@gmail.com,Тимофеева Зинаида Максимовна,+7 (718) 181-72-18,"г. Мелеуз, ул. Марта 8, д. 29, 348306",F,045069144022,rantonov,"['http://www.ip.net/', 'http://rao.com/', 'http://www.koshelev.org/', 'http://www.safonov.org/']"
295,"п. Долинск, ул. Свободная, д. 58, 341907",2009-09-10,0+,РАО «Агафонова-Попова»,Хирург,prokl78@hotmail.com,Баранова Элеонора Ниловна,+7 281 341 25 63,"г. Канск, ул. Дачная, д. 22, 626817",F,488971141337,bogdanovaeleonora,"['https://www.rao.info/', 'https://www.ip.net/']"
296,"клх Славгород, ул. Дорожная, д. 65, 779418",1977-10-21,AB+,"РАО «Федорова, Суханов и Никифоров»",Офтальмолог,mihe2005budimir_1998@rambler.ru,Горбачев Никандр Жанович,+7 223 479 5781,"к. Корсаков, ул. Калужская, д. 65, 805719",M,684071491767,larionovaanastasija,['https://npo.net/']
297,"д. Лазаревское, ул. Подлесная, д. 07, 738091",2010-02-28,AB-,Лапин,Гидролог,akim86@hotmail.com,Бирюков Зосима Александрович,+7 (644) 983-7205,"ст. Славянск-на-Кубани, ул. Набережная, д. 98, 616858",M,108158258504,cershov,['https://rao.org/']
298,"клх Новомичуринск, ул. Крылова, д. 46, 444248",2006-10-29,0-,НПО «Сидоров Андреева»,Ювелир,ljudmila11@hotmail.com,Овчинников Артем Витальевич,+7 (046) 111-8246,"г. Ноглики, ул. Тенистая, д. 88, 595272",M,231927077815,onazarova,['http://ao.ru/']
299,"с. Шадринск, ул. Петровская, д. 66, 278352",1985-01-11,0-,РАО «Дорофеева»,Каменотёс,evpraksija72@hotmail.com,Маслов Филипп Иларионовичх,+7 124 346 07 13,"клх Октябрьский (Башк.), ул. Бабушкина, д. 44, 214327",M,634128515685,zoja_16,"['https://www.kolobov.com/', 'https://www.rao.edu/']"
300,"клх Верхний Тагил, ул. Горького, д. 71, 867353",2014-08-21,AB-,НПО «Фомин-Белова»,Журналист,smirnovavarvara@yahoo.com,г-н. Никифоров Иннокентий Эдуардович,+7 141 529 11 07,"д. Курск, ул. Титова, д. 54, 349995",M,593103856662,irakli_75,"['http://rao.org/', 'https://www.ip.biz/', 'https://rao.biz/', 'https://www.ao.info/']"
301,"к. Алдан, ул. Привольная, д. 61, 268671",1990-11-26,0+,АО «Волкова Кузнецова»,Мануалист,gorbunovaraisa@mail.ru,Алексеева Вера Георгиевна,+7 305 153 4785,"д. Краснодар, ул. Крылова, д. 54, 769213",F,730423835453,krjukovagalina,"['https://www.ao.biz/', 'http://ip.com/', 'http://ao.biz/']"
302,"клх Новосибирск, ул. Безымянная, д. 15, 297957",2015-08-19,A+,Кузьмина,Генетик,nmuhin@hotmail.com,Ефремов Никифор Григорьевич,+7 809 447 27 77,"с. Кинешма, ул. Степная, д. 35, 340420",M,387671297549,grigori08,"['https://ip.com/', 'http://ip.ru/', 'http://www.evdokimova.ru/', 'http://ip.ru/']"
303,"клх Кострома, ул. Ольховая, д. 30, 442928",1982-04-24,AB-,Субботин,Реаниматолог,jan1982platon_2015@yahoo.com,Морозова Татьяна Вячеславовна,+7 994 626 54 99,"п. Тарко-Сале, ул. Дальневосточная, д. 19, 695238",F,818755665594,kolobovanadezhda,"['http://rao.edu/', 'https://ao.org/', 'http://www.npo.info/', 'https://ip.org/']"
304,"п. Моздок, ул. Чапаева, д. 52, 120878",2013-04-18,AB-,РАО «Пахомов-Зиновьева»,Прозектор,kuzma2011varfolome_1973@mail.ru,Орехов Арсений Антонович,+7 (196) 065-18-43,"ст. Двинской, ул. Гаражная, д. 88, 078720",M,561672646365,anisimovfedor,"['https://gusev.com/', 'https://ao.net/', 'http://www.npo.ru/', 'http://www.ao.info/']"
305,"д. Новомичуринск, ул. Тамбовская, д. 35, 950370",1971-09-03,B-,"РАО «Носкова, Самсонова и Шаров»",Кардиолог,fburova@mail.ru,Смирнов Ермил Даниилович,+7 003 051 9663,"ст. Верхотурье, ул. 9 Мая, д. 41, 090447",M,337929000968,timofeevsvetozar,"['https://zinoveva.biz/', 'https://ao.ru/']"
306,"клх Анапа, ул. Баумана, д. 85, 648578",1981-06-27,A+,Субботин,Детектив,kononovparamon@hotmail.com,Федотов Викентий Евстигнеевич,+7 184 887 9031,"ст. Тамбей, ул. Морозова, д. 81, 677488",M,858510750555,jakubnaumov,"['http://www.rao.info/', 'http://kulikov.net/']"
307,"к. Сунтар, ул. Широкая, д. 42, 721987",1999-12-22,A-,РАО «Мишин-Нестерова»,Андролог,boris_37@rambler.ru,Абрамова Ульяна Вячеславовна,+7 739 202 27 80,"г. Малоярославец, ул. Куйбышева, д. 45, 024651",F,000263897507,nikifor11,"['https://www.npo.info/', 'https://npo.com/', 'https://npo.info/', 'https://ao.com/']"
308,"п. Листвянка (Иркут.), ул. Менделеева, д. 13, 368835",1996-07-27,AB-,АО «Горшков-Рыбакова»,Снабженец,nosovafinogen@mail.ru,Сысоева София Сергеевна,+7 263 693 7697,"г. Меренга, ул. Черняховского, д. 48, 990726",F,243747387084,nikanor_86,"['https://www.rao.org/', 'http://www.ao.edu/', 'https://rao.net/', 'https://fomichev.org/']"
309,"ст. Мурманск, ул. Дружбы, д. 55, 109038",1993-04-27,B+,ИП «Игнатов»,Астрофизик,bikovanani@mail.ru,Мартынова Раиса Натановна,+7 (822) 492-8955,"ст. Баргузин, ул. Станционная, д. 76, 153588",F,366117201415,uvarovrjurik,"['https://ignatev.ru/', 'https://npo.com/']"
310,"с. Данков, ул. Красная, д. 70, 546905",2015-01-20,A+,ИП «Козлов Егорова»,Дипломатический работник,fokinaemilija@yandex.ru,Попова Лидия Аскольдовна,+7 319 695 61 19,"к. Диксон, ул. Ударная, д. 82, 045731",F,398842698082,kolesnikovgerasim,"['https://ip.edu/', 'http://www.shilov.net/', 'https://www.ip.com/', 'https://www.agafonova.info/']"
311,"к. Адыгейск, ул. Пограничная, д. 05, 285699",2005-05-18,AB+,РАО «Ковалева»,Сварщик,orlovaregina@mail.ru,Меркушева Валерия Ивановна,+7 (194) 995-75-13,"ст. Южноуральск, ул. Мелиораторов, д. 59, 236755",F,586156535785,anzhela43,['http://ip.org/']
312,"д. Шилка, ул. Хвойная, д. 18, 910120",2000-12-08,A-,Лазарев,Тальман,vrjabov@yahoo.com,Тимофеева Анжела Робертовна,+7 807 839 51 49,"п. Якша, ул. Войкова, д. 40, 835838",F,591944900194,mark2010filipp_2014,"['https://www.kalashnikov.net/', 'http://ip.com/', 'http://www.ip.net/']"
313,"п. Игнашино, ул. Севастопольская, д. 44, 820312",1977-09-24,A+,ИП «Пономарев Степанова»,Сборщик,rodion_69@hotmail.com,Гущин Михаил Тарасович,+7 570 020 8460,"к. Жуковский, ул. Есенина, д. 76, 756509",M,280682858368,blinovamvrosi,"['https://www.ip.edu/', 'https://www.npo.ru/']"
314,"к. Чегем, ул. Почтовая, д. 37, 980884",1975-09-20,A-,РАО «Панфилов»,Биоинженер,drozdovaoktjabrina@hotmail.com,Журавлева Нина Тарасовна,+7 676 511 43 18,"клх Томпа, ул. Кольцевая, д. 96, 201509",F,393104966779,filaret31,"['https://ip.ru/', 'https://www.ip.net/', 'http://ao.org/']"
315,"г. Тайшет, ул. Плеханова, д. 64, 629922",2005-05-05,A-,АО «Николаева»,Маркитант,efrem1976agafon_1989@yahoo.com,Матвеев Онуфрий Харлампович,+7 460 601 82 03,"п. Усть-Калманка, ул. Крупской, д. 76, 198456",M,687978290239,timur_51,"['https://www.rao.com/', 'http://kirillova.net/']"
316,"с. Россошь, ул. Толбухина, д. 31, 013203",1977-04-05,AB+,ИП «Некрасова»,Инженер-строитель,maksimbaranov@mail.ru,Белякова Анастасия Леоновна,+7 (464) 489-49-68,"клх Певек, ул. Садовая, д. 45, 082985",F,015851142754,vladilenburov,"['https://npo.ru/', 'http://npo.ru/', 'https://lazareva.info/']"
317,"д. Катав-Ивановск, ул. Шаумяна, д. 46, 477578",1975-08-24,0-,ИП «Горшкова-Белоусова»,Оператор машинного доения,sobolevfilipp@rambler.ru,Бурова Евгения Кузьминична,+7 (070) 181-46-49,"с. Усть-Джегута, ул. Ударная, д. 34, 899023",F,516248808781,angelina2002nikita_2007,"['https://ao.biz/', 'http://ip.edu/']"
318,"с. Энгельс, ул. Космодемьянской, д. 65, 544992",1985-01-03,A-,АО «Осипов»,Авиатехник,viktorin1999stanimir_1991@hotmail.com,Сорокин Прокофий Исидорович,+7 362 214 9780,"п. Челябинск, ул. Красноярская, д. 94, 953798",M,021026350067,tverdislavnikolaev,"['http://www.npo.org/', 'https://ip.com/', 'https://www.npo.com/', 'http://gromov.com/']"
319,"к. Шумиха, ул. Попова, д. 67, 887157",1979-06-28,A+,ИП «Воронцова Горбунова»,Эпидемиолог,vorontsovermola@rambler.ru,Киселев Филарет Давидович,+7 600 540 15 37,"с. Шумиха, ул. Пожарского, д. 25, 855911",M,604663388272,qdoronina,"['https://www.ip.ru/', 'http://www.ip.info/']"
320,"д. Агата, ул. Льва Толстого, д. 83, 947653",2011-09-30,0+,"РАО «Бирюков, Лебедева и Моисеева»",Санитар,fedoseevvitali@rambler.ru,Григорьева Юлия Алексеевна,+7 750 079 4655,"клх Городовиковск, ул. Октябрьская, д. 07, 595780",F,884603092049,natan_90,['http://www.rao.net/']
321,"г. Кузнецк, ул. Российская, д. 80, 246983",2009-03-02,0-,НПО «Полякова»,Бондарь,nosovsvetozar@yandex.ru,Фадеев Фотий Яковлевич,+7 370 711 8250,"п. Агинское (Забайк.), ул. Ермака, д. 96, 876220",M,749381881140,kkarpov,"['https://ao.com/', 'https://ao.biz/', 'http://www.npo.net/', 'https://shcherbakova.ru/']"
322,"ст. Саров (Морд.), ул. Мелиоративная, д. 48, 344993",2002-06-12,A+,"РАО «Муравьева, Самсонов и Новиков»",Мельник,wnesterova@rambler.ru,Мухина Таисия Викторовна,+7 748 503 7409,"клх Москва, ул. Главная, д. 21, 197519",F,640490837962,sorokinaraisa,"['https://www.npo.info/', 'http://naumova.ru/', 'http://www.rao.org/']"
323,"к. Владивосток, ул. Станционная, д. 27, 714610",1981-01-18,0+,РАО «Соловьева»,Выпускающий редактор,mitofanmishin@yahoo.com,Ермаков Лукьян Игнатович,+7 734 167 6684,"д. Калуга, ул. Донская, д. 43, 142752",M,804835551326,orest_88,"['https://ip.biz/', 'https://www.npo.biz/', 'http://terenteva.edu/', 'http://www.npo.info/']"
324,"к. Ржев, ул. Подстанция, д. 65, 517393",2004-06-22,A-,РАО «Захаров Иванов»,Актуарий,ukolesnikova@hotmail.com,Дроздова Таисия Валериевна,+7 (860) 840-47-06,"клх Новгород Великий, ул. Энтузиастов, д. 16, 209597",F,968708715775,dementevdemjan,"['http://rao.net/', 'http://ilin.ru/', 'http://www.npo.info/', 'https://www.gorbunova.net/']"
325,"клх Новороссийск, ул. Мостовая, д. 32, 584543",1982-09-17,AB-,АО «Горшков-Марков»,Торговый представитель,uvarovsevastjan@rambler.ru,Доронина Валентина Наумовна,+7 857 345 83 06,"п. Киржач, ул. Павлова, д. 04, 568382",F,276061212911,seliverstovpankrati,"['http://www.ao.biz/', 'http://www.markov.info/', 'http://rao.com/']"
326,"п. Новый Уренгой, ул. Пирогова, д. 57, 214176",1984-10-04,B-,АО «Беспалов Моисеев»,Зенитчик,sinklitikija_26@yandex.ru,Мамонтова Зоя Анатольевна,+7 159 227 52 07,"к. Ростов, ул. Зеленая, д. 73, 062633",F,081866665106,jaroslav_28,"['https://www.fedotova.net/', 'http://www.ip.info/', 'http://www.bikova.net/', 'http://www.ao.info/']"
